product_id,product_title,rating,summary,review
1,Women's Black Faux Fur Jacket,5,Luxurious winter statement piece,This black faux fur jacket is absolutely stunning! Soft and warm for winter. The oversized fit is trendy and comfortable. Worth every penny!
2,Women's Pink Square Neck T-Shirt,4,Flattering fit and color,This pink square neck top is flattering with a perfect soft pink color. Material is stretchy and comfortable. Square neckline adds a nice touch.
3,Women's Beige Athletic Crop Top,2,Disappointing fit issues,The fit is off. Material is good quality but band is too tight while top is loose. Not comfortable for workouts.
4,Women's Red Patterned Wrap Top,3,Beautiful design but wrinkles easily,Gorgeous pattern and flattering cut. Works for casual and dressy occasions. Unfortunately wrinkles easily and requires ironing.
5,Women's Sparkly V-Neck Blouse,4,Perfect for special occasions,Great for nights out! Just the right amount of shimmer. V-neck is flattering. Only downside is initial glitter shedding.
6,Women's Modest Hijab Set,5,Beautiful and practical modest wear,Beautiful well-made hijab set. Rich color and breathable material. Matching bag is lovely. Fabric drapes nicely and stays in place.
7,Women's White Turtleneck,4,Great basic with minor issues,Great wardrobe staple. Soft material and slim fit. Slightly see-through so layering needed. Perfect for fall and winter.
8,Women's Patterned Short Sleeve Blouse,3,Pretty pattern but wrinkles easily,Elegant pattern and flattering cut. Material wrinkles easily and requires frequent ironing. Buttons feel flimsy.
9,Women's Pink Floral Blouse,5,Beautiful spring essential,Gorgeous floral pattern! Feminine and flattering. Lightweight material perfect for spring and summer. Elegant bell sleeves.
10,Women's Burgundy Casual Top,3,Nice color but runs small,Rich burgundy color is beautiful. Runs small and material has little stretch. Versatile style but sizing is an issue.
11,Women's Black Crop Tank,4,Versatile basic with good quality,Great wardrobe staple. Material is thick enough and straps are perfect width. Pairs well with high-waisted bottoms. Washes well.
12,Women's Navy Fitted Top,5,Perfect basic for any wardrobe,Perfect navy top! Substantial material that doesn't fade when washed. Flattering fit and perfect length. Great investment piece!
13,Men's Green Zippered Jacket,4,Great everyday jacket,Perfect casual jacket. Good quality material and true to size fit. Smooth zipper and spacious pockets. Definitely recommend.
14,Men's White and Navy Color Block Jacket,5,Stylish and comfortable,Love this color block jacket! Lightweight yet warm. Perfect fit and modern design. Goes with everything. Best purchase this season!
15,Men's Black Marble Print Jacket,3,Unique design but sizing issues,Eye-catching marble print design. Sizing runs small - needed larger size. Material is thinner than expected for the price.
16,Men's Colorblock Sports Jacket,5,Perfect for active lifestyle,Fantastic sports jacket! Colors look great in person. Lightweight and breathable for running or casual wear. Very happy with purchase.
17,Men's Classic Denim Jacket,4,Timeless piece for any wardrobe,Essential denim jacket with perfect wash. Slightly stiff at first but softens with wear. Slightly boxy fit. Great for fall layering.
18,Men's Light Grey Zip-Up Hoodie,2,Disappointing quality,Nice color and style but poor fabric quality. Material pills and color fades after washing. Zipper catches. Not worth the price.
19,Men's White Athletic Zip Jacket,5,Perfect gym companion,Perfect for gym sessions! Material wicks moisture effectively. Sleek modern design with athletic fit. Highly recommend!
20,Men's Navy Blue Casual Jacket,4,Versatile addition to wardrobe,Extremely versatile navy jacket for work or casual wear. Nice weight material and true navy color. Sleeves slightly long.
21,Men's Color Block Outdoor Jacket,3,Good for light rain but not durable,Stylish jacket that performs well in light rain. After 3 months seams started coming apart. Not as durable as hoped.
22,Men's White Puffer Hoodie,4,Warm and stylish winter option,Surprisingly warm for lightweight hoodie. Hood fits well and look is clean and modern. Shows dirt easily but washes well.
23,Men's Teal Denim Jacket,3,Nice color but stiff material,Unique teal color is eye-catching. Material remains stiff even after washing. Good fit and functional pockets.
24,Men's Black Leather Biker Jacket,5,Classic piece worth every penny,Perfect leather jacket! Soft yet durable leather with classic biker style. Perfect fit and great details. Definitely an investment piece.
25,Boys' Blue Apple Print Hoodie,5,Adorable and durable kids' hoodie,Son loves the apple print! Soft yet durable material that stays bright after washing. True to size with room to grow.
26,Boys' Black Graphic Hoodie,4,Cool design but runs small,Cool graphic design that my son loves. Soft warm material for cool days. Runs small so size up. Great quality and washes well.
27,Boys' Navy Colorblock Hoodie,5,Stylish and comfortable,Stylish and practical colorblock hoodie. Gets compliments. Soft material and well-fitting hood. Colors stay bright with washing.
28,Boys' Green Crewneck Sweatshirt,3,Nice color but pills easily,Lovely green color with subtle logo. Material pills after few washes. Comfortable fit but quality isn't what I expected.
29,Boys' Colorblock Zip Jacket,4,Great layering piece,Perfect spring/fall jacket. Smooth zipper that's easy for kids to manage. Versatile colors. Washes well but needs ironing.
30,Boys' Olive Quilted Jacket,5,Perfect for cooler weather,Excellent quality quilted jacket! Warm without bulk and neutral color matches everything. Good pockets and collar. Still looks new after winter.
31,Boys' Denim Jacket with Patch,3,Cute design but stiff material,Adorable earth patch design. Denim is stiff and uncomfortable. Has softened somewhat with washing. Accurate sizing.
32,Boys' Blue Athletic Set,4,Great for active kids,Perfect for active children. Lightweight durable material that dries quickly. Comfortable with good movement. Blue color fades slightly.
33,Boys' Navy Logo Sweatshirt,4,Simple but effective everyday piece,Great basic sweatshirt. Soft material that holds up to wear and washing. True to size with growing room. Reliable option for school.
34,Boys' Navy Zip-Up Jacket,5,High quality and practical,Go-to outerwear with excellent quality. Smooth zipper and soft durable material. Lightweight yet warm. Highly recommend!
35,Boys' Black and Orange Track Jacket,4,Sporty and stylish,Son loves this Puma track jacket. Lightweight material perfect for sports. Sleeves slightly long but room to grow.
36,Boys' Black and White Jacket,3,Stylish but zipper issues,Stylish black and white design that my son loves. Zipper gets stuck frequently which is frustrating. Good material and fit.